{
  "number": "002",
  "slug": "002",
  "title": "The Release Date Became a Question",
  "subtitle": "Backrooms reached the week of its reported PVOD debut, but the storefront evidence still points to a release in motion rather than a settled home-viewing answer.",
  "publishedDate": null,
  "updatedDate": "2026-07-08",
  "dateline": "THE THRESHOLD // FIELD DISPATCH",
  "status": "review",
  "lead": {
    "title": "The calendar was not enough",
    "summary": "Edition 001 logged AP's July 7 premium-video-on-demand report as a useful U.S. viewer lead. Edition 002 checks that lead against retailer pages after the date arrived. The result is not a clean launch record: Prime Video exposed a pre-order page with release date still coming soon, Apple TV search showed the title as unavailable, and theatrical listings continued to describe the Everything Must Go footage as theatrically exclusive."
  },
  "briefings": [
    {
      "title": "The July 7 PVOD date is now disputed evidence",
      "date": "2026-07-08",
      "classification": "Disputed // platform-specific",
      "summary": "AP reported a July 7 PVOD debut, but Prime Video still listed Backrooms as a UHD pre-order with release date coming soon when checked July 8. Apple TV search likewise displayed the title as unavailable in the U.S. storefront.",
      "analysis": "The archive should no longer phrase July 7 as an accomplished digital release. It can be described as a reported date that failed to resolve into platform-wide availability during the reviewed check. Storefront availability is volatile, so this remains a moving file rather than a final correction.",
      "sourceIds": [
        "source-ap-backrooms-pvod-2026-07-03",
        "source-prime-video-backrooms-preorder-2026-07-08",
        "source-apple-tv-backrooms-search-2026-07-08",
        "source-decider-backrooms-digital-delay-2026-07-07"
      ]
    },
    {
      "title": "Everything Must Go is still described as theatrical",
      "date": "2026-07-03",
      "classification": "Confirmed // duration varies",
      "summary": "A24's July 3 post said Backrooms: Everything Must Go was playing in theaters nationwide with 16 minutes of new footage. Exhibitor pages continued to describe the footage as theatrically exclusive, though listings vary between 15 and 16 minutes and between 126 and 127 minutes.",
      "analysis": "The practical U.S. viewer question is not whether the footage exists; it does. The unresolved question is whether any home-viewing version includes it. Until a retailer or studio page says so, the safest catalog entry treats the bonus as theatrical-only in the available evidence.",
      "sourceIds": [
        "source-a24-x-everything-must-go-2026-07-03",
        "source-siff-everything-must-go-2026-07-03",
        "source-loft-everything-must-go-2026-07-08",
        "source-laemmle-everything-must-go-2026-07-08"
      ]
    },
    {
      "title": "The extra footage keeps the YouTube pipeline visible",
      "date": "2026-07-03",
      "classification": "Reported // creator process",
      "summary": "GamesRadar+ reported Parsons' Discord comments that the Everything Must Go addition was made in just under two weeks, all in Blender on his laptop, and delivered through a workflow he compared to his YouTube pipeline.",
      "analysis": "That process detail is worth preserving because it keeps the theatrical addendum connected to Parsons' native production habits rather than treating it as a standard studio extended cut. The original Discord post should still be captured before this is promoted to primary evidence.",
      "sourceIds": [
        "source-gamesradar-everything-must-go-process-2026-07-03",
        "source-youtube-kane-pixels-channel-2026-07-05"
      ]
    },
    {
      "title": "Sequel talk remains narrative intent, not a production start",
      "date": "2026-06-02",
      "classification": "Reported // no greenlight",
      "summary": "People reported Parsons' comments that there is a narrative plan for Backrooms and that the story is not complete. The same report stated that no sequel had been officially greenlit and no cast attachments had been announced.",
      "analysis": "This supports a stronger creative-continuity claim than a pure rumor, but it still does not create a production calendar. Edition 002 keeps sequel language in the background because the current actionable change is home-release uncertainty.",
      "sourceIds": [
        "source-people-backrooms-sequel-plan-2026-06-02",
        "source-deadline-backrooms-sequel-2026-06-01"
      ]
    }
  ],
  "timelineHighlights": [
    "event-2026-07-08-backrooms-digital-status-disputed",
    "event-2026-07-07-backrooms-pvod-reported",
    "event-2026-07-03-everything-must-go-release",
    "event-2026-06-01-backrooms-sequel-early-development"
  ],
  "watchList": [
    {
      "title": "Retailer proof",
      "text": "Recheck Prime Video, Apple TV, Fandango at Home, and A24 surfaces before publication. Treat each storefront independently because one page can update before the others."
    },
    {
      "title": "Bonus-footage scope",
      "text": "Do not say a digital purchase includes Everything Must Go unless a retailer, studio page, or captured playback metadata identifies the bonus footage or extended edition."
    },
    {
      "title": "Original Discord context",
      "text": "Find the original Parsons Discord post behind the GamesRadar+ report before treating the laptop/Blender process note as primary evidence."
    }
  ],
  "corrections": [],
  "sourceIds": [
    "source-ap-backrooms-pvod-2026-07-03",
    "source-prime-video-backrooms-preorder-2026-07-08",
    "source-apple-tv-backrooms-search-2026-07-08",
    "source-decider-backrooms-digital-delay-2026-07-07",
    "source-a24-x-everything-must-go-2026-07-03",
    "source-siff-everything-must-go-2026-07-03",
    "source-loft-everything-must-go-2026-07-08",
    "source-laemmle-everything-must-go-2026-07-08",
    "source-gamesradar-everything-must-go-process-2026-07-03",
    "source-youtube-kane-pixels-channel-2026-07-05",
    "source-people-backrooms-sequel-plan-2026-06-02",
    "source-deadline-backrooms-sequel-2026-06-01"
  ],
  "editorialNote": "Edition 002 is in review while storefront availability is rechecked. Publish only after confirming whether the Prime Video pre-order state, Apple TV unavailability state, and any Fandango at Home listing have changed."
}
